"matchId","editionTitle","snappySummary","talkingPoints","randomQuirk"
"PAR_TUR","THE SWEAR-O-METER DISASTER","An absolute circus. Almiron got sent off within forty minutes for swearing at the ref. Paraguay held on for a chaotic 1-0 win.","Galarza scores the opener in 64 seconds;Almiron's red card completely derailed Türkiye's defensive blueprint;Paraguay's physical display ran the clock down effectively","Almiron covering his mouth to swear at the referee, only to get caught by high-definition cameras."
"SCO_MAR","THE MOROCCAN OVERHEAD BEAUTY","Morocco danced through the Scottish midfield and claimed a deserved 2-1 victory. Scotland's late surge was too little, too late.","Morocco's liquid football carved open the Scottish double-decker bus;Conceded to an overhead kick that defied all laws of Scottish gravity;Morocco's defense stood tall under late aerial pressure","A Scottish fan in a kilt spotted reading a tactical guidebook upside-down in the 88th minute."
"USA_AUS","THE STAR-SPANGLED SWAGGER","The USA cruised to a 3-0 victory over Australia. The Socceroos looked like they were having a casual kickabout in the park.","Pulisic was a walking cheat code, scoring two and assisting one;Australia completely bottled it in possession, committing 18 turnovers;The high press from the Americans left Australia gasping for air","An Australian defender trying to clear the ball, only to kick it directly into his own teammate's face."
"BRA_HAI","THE SAMBA EXCURSION","Brazil dominated Haiti 5-0 in a match that felt like a training session. Vinicius Jr scored a hat-trick of pure class.","Vinicius Jr put on a show with three goals and endless flair;Haiti's Sunday League defending conceded three goals from simple corners;Brazil hit the post three times, preventing an even bigger scoreline","A Haitian defender asking Vinicius Jr to swap shirts during a water break in the 30th minute."
"NED-SWE","Dutch Delight, Swedish Nightmare","The Netherlands put on an absolute clinic, tearing Sweden to shreds with five goals, leaving the Swedes looking like they'd forgotten how to defend. A proper thumping!","Brian Brobbey and Cody Gakpo both bagging a brace? Talk about liquid football! They were absolutely unplayable.;Denzel Dumfries, with two assists, was flying down that wing like a man possessed. What a performance!;Sweden's defending was more 'Sunday League' than 'World Cup'. Three yellow cards and conceding five? Woeful.;Despite the scoreline, Sweden actually had more shots and shots on target. Just goes to show, it's about putting them away, isn't it?","Sweden managed to rack up three yellow cards, proving that if you can't beat 'em, at least try to kick 'em. Classy."
"GER-CIV","Germany's Great Escape: Undav to the Rescue!","Germany snatched a dramatic late victory against a spirited Côte d'Ivoire, with Deniz Undav proving to be the hero, bagging a brace including a last-gasp winner. Squeaky bum time for the Germans!","Franck Kessie's opener for Côte d'Ivoire had Germany rattled, but they showed real character to come back.;Deniz Undav, coming off the bench, turned into a walking cheat code, scoring both goals to save Germany's blushes.;Côte d'Ivoire's keeper, Yahia Fofana, was a busy man, making five saves and keeping them in it for so long.;Germany's 59.5% possession and 16 shots show they dominated, but it took them until the dying embers to secure the win.","Germany had three substitutions at the 60-minute mark, a clear sign the gaffer wasn't happy and threw the kitchen sink at it. It paid off, didn't it?"
"ECU-CUW","The Goalless Snoozefest: Ecuador and Curaçao Share the Spoils (and the Blame)","A truly forgettable affair saw Ecuador and Curaçao play out a drab 0-0 draw. Ecuador had all the ball and all the shots, but couldn't hit a barn door, while Curaçao's keeper was an absolute hero.","Ecuador had a staggering 74.6% possession and 27 shots, with 15 on target, yet somehow failed to score. You'd think they were having a casual kickabout in the park!;Eloy Room, Curaçao's goalkeeper, put in an absolute shift, making a ridiculous 15 saves. He was a brick wall!;Curaçao picked up five yellow cards, clearly frustrated by Ecuador's inability to finish, or perhaps just by the sheer boredom of it all.;Both teams managed to avoid scoring despite a combined 37 shots. Clinical finishing? Never heard of it, mate.","Curaçao's five yellow cards were almost as numerous as their shots on target (3). At least they were trying to make an impression, eh?"
"TUN-JPN","Tunisia vs Japan: The Blue Samurai's Masterclass","Japan absolutely ran riot, putting four past a hapless Tunisia who looked like they were having a casual kickabout in the park.","Japan's clinical finishing was a joy to behold, especially Ayase Ueda bagging a brace and an assist.;Tunisia's defence was more open than a motorway service station, conceding four goals and managing zero shots on target.;The drinks breaks seemed to be the only thing slowing Japan down as they dominated with 62.1% possession.","Tunisia managed a grand total of 0 shots on target despite having 37.9% possession, proving that sometimes, just sometimes, football isn't coming home for everyone."
"ESP-KSA","Spain's Stroll in the Park Against Saudi Arabia","Spain put on a clinic, effortlessly dispatching Saudi Arabia with four goals, including a rather unfortunate own goal.","Mikel Oyarzabal was a menace, grabbing two goals and an assist before half-time.;Lamine Yamal showed why he's the real deal, opening the scoring early on with one of his five shots.;Saudi Arabia's defence had a tough day at the office, topped off with an own goal – classic.;Spain's 67.1% possession meant Saudi Arabia were chasing shadows for most of the match, managing only 3 shots.","Saudi Arabia's Hassan Al Tambakti decided to get in on the scoring action, unfortunately for his own side, with a delightful own goal."
"BEL-IRN","Belgium and Iran Play Out a Thrilling... 0-0 Draw","A truly forgettable affair saw Belgium and Iran cancel each other out in a goalless draw, with Belgium even managing a red card for good measure.","Belgium had 23 shots but couldn't hit a barn door with a banjo, managing a paltry 0 goals despite 70.1% possession.;Nathan Ngoy's red card for Belgium added a bit of spice to an otherwise bland encounter.;Iran's keeper, Alireza Beiranvand, was the busiest man on the pitch, making 7 saves.;Romelu Lukaku picked up an early yellow card, clearly more interested in a wrestling match than scoring.","Belgium, with 70.1% possession and 23 shots, still couldn't find the back of the net, proving possession truly is nine-tenths of the law, but goals win games."
"URU-CPV","Uruguay and Cape Verde Share the Spoils in a Four-Goal Thriller","Uruguay and Cape Verde played out a pulsating 2-2 draw, with both sides showing flashes of brilliance and moments of Sunday League defending.","Cape Verde took an early lead from a free-kick, stunning Uruguay with Kevin Pina's strike.;Uruguay fought back with two quick goals before half-time, only to concede again in the second half.;Maxi Araújo was instrumental for Uruguay, scoring one and assisting another.;Cape Verde's Hélio Varela came off the bench and scored a cracker from outside the box.","Uruguay had 11 corners to Cape Verde's 4, but still couldn't find a winner, showing that sometimes quantity doesn't quite beat quality."
"NZL-EGY","Egypt Come From Behind to See Off New Zealand","New Zealand gave Egypt a scare by taking the lead, but the Pharaohs rallied in the second half to secure a comfortable 3-1 victory.","New Zealand's Finn Surman gave them a shock lead with a header from a corner, assisted by Tim Payne.;Mohamed Salah was a walking cheat code, scoring and assisting for Egypt, demonstrating his class with 5 shots.;Mostafa Zico and Trezeguet also got on the scoresheet for Egypt, showing their attacking depth.;New Zealand's two yellow cards suggest they were a bit too eager to get stuck in, with Sarpreet Singh and Callum McCowatt both booked.","New Zealand's Finn Surman scored with their first shot on target, giving them a fleeting moment of glory before Egypt decided to wake up."
"ARG-AUT","Messi's Mixed Bag Masterclass Secures Argentina's Spot","Argentina secured their passage to the next round with a 2-0 victory over Austria, but not before Lionel Messi decided to keep everyone on their toes with a missed penalty before bagging a brace.","Lionel Messi's penalty miss early on had us all wondering if he'd left his magic boots at home, only for him to then casually score two goals.;Austria's lone shot on target suggests they were more interested in admiring Argentina's play than actually troubling the keeper.;Plenty of stoppages for injuries and drinks breaks, making it feel less like a World Cup match and more like a leisurely Sunday kickabout.","Lionel Messi, the man who usually can't miss, decided to give the Austrian keeper a bit of a break by sending his early penalty wide. Just to keep things interesting, I suppose."
"FRA-IRQ","Mbappé and Dembélé Run Riot as France Cruise Through","France breezed past Iraq with a comfortable 3-0 victory, with Kylian Mbappé grabbing a brace and Ousmane Dembélé adding another to send them through to the knockouts.","France's 19 shots to Iraq's paltry 4, with zero on target for Iraq, tells you everything you need to know about the one-sided affair.;Michael Olise was pulling the strings beautifully, bagging two assists and making it all look far too easy.;Iraq's 28 clearances shows they were certainly busy, just not in the way they'd hoped, spending most of the match on the back foot.","Iraq managed to go the entire match without a single shot on target, proving that sometimes, just sometimes, defending can be a full-time job."
"NOR-SEN","Haaland's Heroics Secure Norway's Progress in Five-Goal Thriller","Norway edged out Senegal in a five-goal thriller, winning 3-2 thanks to a brace from the unstoppable Erling Haaland, securing their passage to the next round.","Erling Haaland, the walking cheat code, bagged two goals, making it look like he was having a casual kickabout in the park.;Senegal showed some fight with Ismaïla Sarr also grabbing two goals, making Norway work for every single point.;Senegal had more possession and more shots, but Norway were clinical when it mattered, which is the sign of a team that knows how to win.","Despite having nearly 60% possession and more shots, Senegal still managed to lose. Proof that sometimes, just having the ball isn't enough to actually do anything with it."
"JOR-ALG","Algeria's Late Comeback Sinks Jordan and Seals Qualification","Algeria snatched a dramatic 2-1 victory from Jordan with two late goals, turning the game on its head after going a goal down, and securing their qualification.","Jordan's early lead was a lovely bit of liquid football, but Algeria's relentless pressure eventually paid off with 72% possession and 10 corners.;Nadhir Benbouali and Amine Gouiri both scoring late goals from corners, showing Algeria's set-piece prowess when the chips were down.;Jordan's goalkeeper, Yazeed Abulaila, was absolutely heroic, making 6 saves to keep them in it for so long.","Jordan, with a mere 27.9% possession, managed to score first. It's almost as if they thought the ball was radioactive and only wanted to touch it when absolutely necessary."
