"matchId","editionTitle","snappySummary","talkingPoints","randomQuirk"
"PAR_TUR","THE SWEAR-O-METER DISASTER","An absolute circus. Almiron got sent off within forty minutes for swearing at the ref. Paraguay held on for a chaotic 1-0 win.","Galarza scores the opener in 64 seconds;Almiron's red card completely derailed Türkiye's defensive blueprint;Paraguay's physical display ran the clock down effectively","Almiron covering his mouth to swear at the referee, only to get caught by high-definition cameras."
"SCO_MAR","THE MOROCCAN OVERHEAD BEAUTY","Morocco danced through the Scottish midfield and claimed a deserved 2-1 victory. Scotland's late surge was too little, too late.","Morocco's liquid football carved open the Scottish double-decker bus;Conceded to an overhead kick that defied all laws of Scottish gravity;Morocco's defense stood tall under late aerial pressure","A Scottish fan in a kilt spotted reading a tactical guidebook upside-down in the 88th minute."
"USA_AUS","THE STAR-SPANGLED SWAGGER","The USA cruised to a 3-0 victory over Australia. The Socceroos looked like they were having a casual kickabout in the park.","Pulisic was a walking cheat code, scoring two and assisting one;Australia completely bottled it in possession, committing 18 turnovers;The high press from the Americans left Australia gasping for air","An Australian defender trying to clear the ball, only to kick it directly into his own teammate's face."
"BRA_HAI","THE SAMBA EXCURSION","Brazil dominated Haiti 5-0 in a match that felt like a training session. Vinicius Jr scored a hat-trick of pure class.","Vinicius Jr put on a show with three goals and endless flair;Haiti's Sunday League defending conceded three goals from simple corners;Brazil hit the post three times, preventing an even bigger scoreline","A Haitian defender asking Vinicius Jr to swap shirts during a water break in the 30th minute."
"NED-SWE","Dutch Delight, Swedish Nightmare","The Netherlands put on an absolute clinic, tearing Sweden to shreds with five goals, leaving the Swedes looking like they'd forgotten how to defend. A proper thumping!","Brian Brobbey and Cody Gakpo both bagging a brace? Talk about liquid football! They were absolutely unplayable.;Denzel Dumfries, with two assists, was flying down that wing like a man possessed. What a performance!;Sweden's defending was more 'Sunday League' than 'World Cup'. Three yellow cards and conceding five? Woeful.;Despite the scoreline, Sweden actually had more shots and shots on target. Just goes to show, it's about putting them away, isn't it?","Sweden managed to rack up three yellow cards, proving that if you can't beat 'em, at least try to kick 'em. Classy."
"GER-CIV","Germany's Great Escape: Undav to the Rescue!","Germany snatched a dramatic late victory against a spirited Côte d'Ivoire, with Deniz Undav proving to be the hero, bagging a brace including a last-gasp winner. Squeaky bum time for the Germans!","Franck Kessie's opener for Côte d'Ivoire had Germany rattled, but they showed real character to come back.;Deniz Undav, coming off the bench, turned into a walking cheat code, scoring both goals to save Germany's blushes.;Côte d'Ivoire's keeper, Yahia Fofana, was a busy man, making five saves and keeping them in it for so long.;Germany's 59.5% possession and 16 shots show they dominated, but it took them until the dying embers to secure the win.","Germany had three substitutions at the 60-minute mark, a clear sign the gaffer wasn't happy and threw the kitchen sink at it. It paid off, didn't it?"
"ECU-CUW","The Goalless Snoozefest: Ecuador and Curaçao Share the Spoils (and the Blame)","A truly forgettable affair saw Ecuador and Curaçao play out a drab 0-0 draw. Ecuador had all the ball and all the shots, but couldn't hit a barn door, while Curaçao's keeper was an absolute hero.","Ecuador had a staggering 74.6% possession and 27 shots, with 15 on target, yet somehow failed to score. You'd think they were having a casual kickabout in the park!;Eloy Room, Curaçao's goalkeeper, put in an absolute shift, making a ridiculous 15 saves. He was a brick wall!;Curaçao picked up five yellow cards, clearly frustrated by Ecuador's inability to finish, or perhaps just by the sheer boredom of it all.;Both teams managed to avoid scoring despite a combined 37 shots. Clinical finishing? Never heard of it, mate.","Curaçao's five yellow cards were almost as numerous as their shots on target (3). At least they were trying to make an impression, eh?"
"TUN-JPN","World Cup 2026 Group F","Japan absolutely ran riot, making Tunisia look like they were having a casual kickabout in the park. A proper thrashing!","Japan's clinical finishing was on full display, bagging four goals from just five shots on target.;Tunisia's attack was non-existent, failing to register a single shot on target despite their best efforts.;Japan's dominance in possession (62.1%) and overall shots (11) showed they were in complete control from start to finish.","Tunisia managed a grand total of zero shots on target, making their goalkeeper's single save the most action they saw all game. Bless him."
"ESP-KSA","World Cup 2026 Group H","Spain put on a masterclass, absolutely dismantling Saudi Arabia with a performance that was pure liquid football.","Spain's overwhelming possession (67.1%) and shot count (22 shots, 8 on target) proved their class.;Mikel Oyarzabal was a walking cheat code, bagging two goals and an assist in a sensational display.;Saudi Arabia's defensive struggles were evident, conceding an own goal and picking up two yellow cards.","Saudi Arabia's goalkeeper, Mohammed Al-Owais, made 5 saves, which tells you everything you need to know about the Spanish onslaught. He earned his wages today!"
"BEL-IRN","World Cup 2026 Group G","A truly forgettable stalemate where Belgium managed to get a man sent off and still couldn't break the deadlock against a resolute Iran. Absolute scenes!","Belgium's Nathan Ngoy saw red, adding a bit of drama to an otherwise dull affair.;Iran's heroic defending, with 51 clearances, held off 23 Belgian shots – a proper backs-to-the-wall job.;Belgium's inability to convert 70.1% possession and 23 shots into a single goal is a real concern.","Belgium's Romelu Lukaku managed to get a yellow card faster than he managed a shot on target, setting the tone for a frustrating afternoon."
"URU-CPV","World Cup 2026 Group H","A proper end-to-end thriller where Uruguay threw away a lead, proving that even the big boys can have a bit of a wobble.","Cabo Verde showed incredible fighting spirit, coming back twice to snatch a point against a more fancied opponent.;Uruguay's defensive lapses were evident, conceding two goals despite dominating possession with 65.2%.;Maxi Araújo's goal and assist for Uruguay was a bright spark in what was ultimately a frustrating draw for them.","Cabo Verde's Hélio Varela scored a cracking goal from outside the box just three minutes after coming on as a substitute – talk about making an impact!"
"NZL-EGY","World Cup 2026 Group G","Egypt came from behind to comfortably dispatch New Zealand, with Salah showing why he's the main man. No surprises there, then.","New Zealand initially took the lead, giving their fans a glimmer of hope before Egypt decided to turn up the heat.;Mohamed Salah's goal and assist proved he's still got that magic touch, instrumental in Egypt's comeback.;Egypt's dominance in shots (19) and shots on target (7) reflected their control and eventual victory.","New Zealand's Finn Surman scored the opening goal, giving them a brief moment of glory before Egypt decided to get serious."
