"matchId","editionTitle","snappySummary","talkingPoints","randomQuirk"
"PAR_TUR","THE SWEAR-O-METER DISASTER","An absolute circus. Almiron got sent off within forty minutes for swearing at the ref. Paraguay held on for a chaotic 1-0 win.","Galarza scores the opener in 64 seconds;Almiron's red card completely derailed Türkiye's defensive blueprint;Paraguay's physical display ran the clock down effectively","Almiron covering his mouth to swear at the referee, only to get caught by high-definition cameras."
"SCO_MAR","THE MOROCCAN OVERHEAD BEAUTY","Morocco danced through the Scottish midfield and claimed a deserved 2-1 victory. Scotland's late surge was too little, too late.","Morocco's liquid football carved open the Scottish double-decker bus;Conceded to an overhead kick that defied all laws of Scottish gravity;Morocco's defense stood tall under late aerial pressure","A Scottish fan in a kilt spotted reading a tactical guidebook upside-down in the 88th minute."
"USA_AUS","THE STAR-SPANGLED SWAGGER","The USA cruised to a 3-0 victory over Australia. The Socceroos looked like they were having a casual kickabout in the park.","Pulisic was a walking cheat code, scoring two and assisting one;Australia completely bottled it in possession, committing 18 turnovers;The high press from the Americans left Australia gasping for air","An Australian defender trying to clear the ball, only to kick it directly into his own teammate's face."
"BRA_HAI","THE SAMBA EXCURSION","Brazil dominated Haiti 5-0 in a match that felt like a training session. Vinicius Jr scored a hat-trick of pure class.","Vinicius Jr put on a show with three goals and endless flair;Haiti's Sunday League defending conceded three goals from simple corners;Brazil hit the post three times, preventing an even bigger scoreline","A Haitian defender asking Vinicius Jr to swap shirts during a water break in the 30th minute."
"NED-SWE","Dutch Delight, Swedish Nightmare","The Netherlands put on an absolute clinic, tearing Sweden to shreds with five goals, leaving the Swedes looking like they'd forgotten how to defend. A proper thumping!","Brian Brobbey and Cody Gakpo both bagging a brace? Talk about liquid football! They were absolutely unplayable.;Denzel Dumfries, with two assists, was flying down that wing like a man possessed. What a performance!;Sweden's defending was more 'Sunday League' than 'World Cup'. Three yellow cards and conceding five? Woeful.;Despite the scoreline, Sweden actually had more shots and shots on target. Just goes to show, it's about putting them away, isn't it?","Sweden managed to rack up three yellow cards, proving that if you can't beat 'em, at least try to kick 'em. Classy."
"GER-CIV","Germany's Great Escape: Undav to the Rescue!","Germany snatched a dramatic late victory against a spirited Côte d'Ivoire, with Deniz Undav proving to be the hero, bagging a brace including a last-gasp winner. Squeaky bum time for the Germans!","Franck Kessie's opener for Côte d'Ivoire had Germany rattled, but they showed real character to come back.;Deniz Undav, coming off the bench, turned into a walking cheat code, scoring both goals to save Germany's blushes.;Côte d'Ivoire's keeper, Yahia Fofana, was a busy man, making five saves and keeping them in it for so long.;Germany's 59.5% possession and 16 shots show they dominated, but it took them until the dying embers to secure the win.","Germany had three substitutions at the 60-minute mark, a clear sign the gaffer wasn't happy and threw the kitchen sink at it. It paid off, didn't it?"
"ECU-CUW","The Goalless Snoozefest: Ecuador and Curaçao Share the Spoils (and the Blame)","A truly forgettable affair saw Ecuador and Curaçao play out a drab 0-0 draw. Ecuador had all the ball and all the shots, but couldn't hit a barn door, while Curaçao's keeper was an absolute hero.","Ecuador had a staggering 74.6% possession and 27 shots, with 15 on target, yet somehow failed to score. You'd think they were having a casual kickabout in the park!;Eloy Room, Curaçao's goalkeeper, put in an absolute shift, making a ridiculous 15 saves. He was a brick wall!;Curaçao picked up five yellow cards, clearly frustrated by Ecuador's inability to finish, or perhaps just by the sheer boredom of it all.;Both teams managed to avoid scoring despite a combined 37 shots. Clinical finishing? Never heard of it, mate.","Curaçao's five yellow cards were almost as numerous as their shots on target (3). At least they were trying to make an impression, eh?"
"TUN-JPN","Japan's Clinical Masterclass","Japan absolutely ran riot against a hapless Tunisia, putting four past them with ease and securing their spot in the next round.","Japan's attacking prowess was on full display, converting 4 of their 5 shots on target.;Tunisia's defence was about as organised as a Sunday League pub team, conceding four and registering zero shots on target.;Ayase Ueda bagged a brace, showing Tunisia how it's done.","Tunisia managed a grand total of 0 shots on target, making their attacking strategy look like a casual kickabout in the park rather than a World Cup fixture."
"ESP-KSA","Spain's Stroll in the Park","Spain delivered a dominant performance, cruising past Saudi Arabia with four goals, including a generous own goal from the Saudis.","Spain's Lamine Yamal and Mikel Oyarzabal were on fire, getting on the scoresheet early.;Saudi Arabia's Hassan Al-Tambakti decided to help Spain out with a rather unfortunate own goal.;Spain had 22 shots, 8 on target, showing their intent, while Saudi Arabia barely troubled the keeper with only 1 shot on target.","Saudi Arabia's Hassan Al-Tambakti scored the most clinical goal for his team today; unfortunately, it was an own goal, proving sometimes you just can't trust your own side."
"BEL-IRN","The Snoozefest of the Tournament","Belgium and Iran played out a truly forgettable goalless draw, a result that sees Belgium pack their bags and Iran sneak through.","Belgium had 23 shots but couldn't hit a barn door, managing 7 on target but zero goals.;Nathan Ngoy of Belgium decided to make an early exit with a red card, probably couldn't stand the boredom either.;Iran defended resolutely, clearing the ball 51 times, which is about 50 more times than Belgium managed to clear their name from this drab performance.","Belgium's Nathan Ngoy received a red card, perhaps a tactical move to escape the sheer tedium of a goalless draw where his team had 23 shots but no joy."
"URU-CPV","Cagey Affair Ends in Stalemate","Uruguay and Cape Verde shared the spoils in a hard-fought 2-2 draw, with both sides showing flashes of brilliance and moments of defensive frailty.","Cape Verde took an early lead from a free-kick, showing Uruguay they weren't just there for the sunshine.;Maxi Araújo and Agustín Canobbio pulled Uruguay back into it, but Hélio Varela ensured Cape Verde had the last laugh.;Uruguay had 11 corners, but only managed 2 shots on target, proving corners aren't always gold dust.","Cape Verde's Hélio Varela came off the bench and scored within three minutes, proving sometimes you just need to bring on someone who actually fancies a shot!"
"NZL-EGY","Egypt's Second Half Surge","Egypt came from behind to beat New Zealand, with goals from Mostafa Zico, Mohamed Salah, and Trezeguet sealing their qualification.","New Zealand took a shock lead through Finn Surman, giving the Egyptians a bit of a fright.;Mohamed Salah was, as usual, the main man for Egypt, bagging a goal and an assist.;Egypt demonstrated their clinical edge in the second half, turning the game around with three goals from 7 shots on target.","New Zealand's Finn Surman scored his team's only goal, perhaps a rare moment of excitement for the All Whites before Egypt decided to turn up the heat."
