"matchId","editionTitle","snappySummary","talkingPoints","randomQuirk"
"PAR_TUR","THE SWEAR-O-METER DISASTER","An absolute circus. Almiron got sent off within forty minutes for swearing at the ref. Paraguay held on for a chaotic 1-0 win.","Galarza scores the opener in 64 seconds;Almiron's red card completely derailed Türkiye's defensive blueprint;Paraguay's physical display ran the clock down effectively","Almiron covering his mouth to swear at the referee, only to get caught by high-definition cameras."
"SCO_MAR","THE MOROCCAN OVERHEAD BEAUTY","Morocco danced through the Scottish midfield and claimed a deserved 2-1 victory. Scotland's late surge was too little, too late.","Morocco's liquid football carved open the Scottish double-decker bus;Conceded to an overhead kick that defied all laws of Scottish gravity;Morocco's defense stood tall under late aerial pressure","A Scottish fan in a kilt spotted reading a tactical guidebook upside-down in the 88th minute."
"USA_AUS","THE STAR-SPANGLED SWAGGER","The USA cruised to a 3-0 victory over Australia. The Socceroos looked like they were having a casual kickabout in the park.","Pulisic was a walking cheat code, scoring two and assisting one;Australia completely bottled it in possession, committing 18 turnovers;The high press from the Americans left Australia gasping for air","An Australian defender trying to clear the ball, only to kick it directly into his own teammate's face."
"BRA_HAI","THE SAMBA EXCURSION","Brazil dominated Haiti 5-0 in a match that felt like a training session. Vinicius Jr scored a hat-trick of pure class.","Vinicius Jr put on a show with three goals and endless flair;Haiti's Sunday League defending conceded three goals from simple corners;Brazil hit the post three times, preventing an even bigger scoreline","A Haitian defender asking Vinicius Jr to swap shirts during a water break in the 30th minute."
"NED-SWE","Dutch Delight, Swedish Nightmare","The Netherlands put on an absolute clinic, tearing Sweden to shreds with five goals, leaving the Swedes looking like they'd forgotten how to defend. A proper thumping!","Brian Brobbey and Cody Gakpo both bagging a brace? Talk about liquid football! They were absolutely unplayable.;Denzel Dumfries, with two assists, was flying down that wing like a man possessed. What a performance!;Sweden's defending was more 'Sunday League' than 'World Cup'. Three yellow cards and conceding five? Woeful.;Despite the scoreline, Sweden actually had more shots and shots on target. Just goes to show, it's about putting them away, isn't it?","Sweden managed to rack up three yellow cards, proving that if you can't beat 'em, at least try to kick 'em. Classy."
"GER-CIV","Germany's Great Escape: Undav to the Rescue!","Germany snatched a dramatic late victory against a spirited Côte d'Ivoire, with Deniz Undav proving to be the hero, bagging a brace including a last-gasp winner. Squeaky bum time for the Germans!","Franck Kessie's opener for Côte d'Ivoire had Germany rattled, but they showed real character to come back.;Deniz Undav, coming off the bench, turned into a walking cheat code, scoring both goals to save Germany's blushes.;Côte d'Ivoire's keeper, Yahia Fofana, was a busy man, making five saves and keeping them in it for so long.;Germany's 59.5% possession and 16 shots show they dominated, but it took them until the dying embers to secure the win.","Germany had three substitutions at the 60-minute mark, a clear sign the gaffer wasn't happy and threw the kitchen sink at it. It paid off, didn't it?"
"ECU-CUW","The Goalless Snoozefest: Ecuador and Curaçao Share the Spoils (and the Blame)","A truly forgettable affair saw Ecuador and Curaçao play out a drab 0-0 draw. Ecuador had all the ball and all the shots, but couldn't hit a barn door, while Curaçao's keeper was an absolute hero.","Ecuador had a staggering 74.6% possession and 27 shots, with 15 on target, yet somehow failed to score. You'd think they were having a casual kickabout in the park!;Eloy Room, Curaçao's goalkeeper, put in an absolute shift, making a ridiculous 15 saves. He was a brick wall!;Curaçao picked up five yellow cards, clearly frustrated by Ecuador's inability to finish, or perhaps just by the sheer boredom of it all.;Both teams managed to avoid scoring despite a combined 37 shots. Clinical finishing? Never heard of it, mate.","Curaçao's five yellow cards were almost as numerous as their shots on target (3). At least they were trying to make an impression, eh?"
"TUN-JPN","Japan's Clinical Masterclass Sends Tunisia Packing","Japan put on a clinical display, dismantling Tunisia with four goals and securing their spot in the next round, while Tunisia offered absolutely nothing going forward.","Japan's attacking prowess, with four different goal scorers showing their depth.;Tunisia's complete lack of attacking threat, managing a grand total of 0 shots on target.;Japan's comfortable qualification to the knockout stages, looking like a real dark horse.;Tunisia's early exit from the tournament, a truly forgettable campaign.","Tunisia managed a grand total of zero shots on target, proving that sometimes, you just turn up for the free drinks break and a bit of a runaround."
"ESP-KSA","Spain Cruises Past Hapless Saudi Arabia in Dominant Display","Spain delivered a dominant performance, scoring four goals, including an own goal, to comfortably dispatch Saudi Arabia and book their place in the next round.","Spain's overwhelming possession (67.1%) and shot count (22 shots), showing complete control.;Mikel Oyarzabal's brace for Spain, a proper striker's performance.;Saudi Arabia's unfortunate own goal from Hassan Al-Tambakti, adding insult to injury.;Saudi Arabia's two yellow cards and general lack of discipline, reflecting their frustration.;Spain's confirmed qualification, looking formidable.","Saudi Arabia's Hassan Al-Tambakti decided to get in on the scoring action, unfortunately for his own side, with a rather spectacular own goal."
"BEL-IRN","Red Card Drama in Stale Stalemate as Belgium's Dream Dies","Belgium and Iran played out a goalless draw, a result that sees Iran through but sends the ten-man Belgians packing after a rather forgettable performance.","Belgium's Nathan Ngoy receiving a red card, making a tough task even harder and sealing their fate.;Iran's resolute defending to secure a vital point, with Alireza Beiranvand making 7 saves.;Belgium's inability to convert 23 shots into a single goal, despite 70.1% possession.;Iran's qualification, proving that grit and a good keeper can get you far.","Belgium managed a whopping 23 shots, with 7 on target, yet still couldn't find the back of the net. Perhaps they were aiming for the corner flags instead of the goal?"
"URU-CPV","Four-Goal Thriller Sees Uruguay Through, Cape Verde Bows Out Bravely","Uruguay and Cape Verde shared the spoils in an entertaining 2-2 draw, with Uruguay securing their progression despite a spirited fight from the island nation.","Cape Verde taking an early lead from a free-kick, showing they weren't just there to make up the numbers.;Uruguay's quick response with two goals before halftime, showing their experience.;Cape Verde's Hélio Varela scoring a fantastic equaliser, a real moment of quality.;Uruguay's qualification confirmed, though they'll need to tighten up.;Cape Verde's elimination despite a valiant effort, they can hold their heads high.","Cape Verde's Kevin Pina scored a cracking free-kick, proving that sometimes, the underdog truly does have a bit of magic up their sleeve."
"NZL-EGY","Salah Inspires Egyptian Comeback as New Zealand's Hopes Fade","Egypt recovered from an early setback to comfortably beat New Zealand 3-1, with Mohamed Salah pulling the strings and securing Egypt's spot in the next round.","New Zealand's surprising early lead, giving their fans a brief moment of hope.;Egypt's strong second-half performance, showing their quality when it mattered.;Mohamed Salah's goal and assist, proving he's a walking cheat code.;Egypt's confirmed qualification, looking like a team that can go far.;New Zealand's elimination from the tournament, a tough lesson learned.","New Zealand's Finn Surman scored the opening goal, proving that even when you're going home, you can still have your moment in the sun."
