"teamId","headline","storySoFar","whatsNext","pubAmmo"
"BIH","The Defensive Circus","Scraped a point against Canada, but absolutely imploded against Switzerland. Two yellows and a straight red in a 20-minute spell turned their defense into a circus in a 4-1 loss.","Need to figure out how to keep 11 men on the pitch if they want any realistic chance of progression.","Did you know Bosnia managed to tackle themselves out of the Switzerland game by collecting three cards between the 59th and 80th minutes?"
"ENG","Slightly Better Than Terrible, But Barely","Scraped by on penalties against Denmark. Absolute Sunday-League coordination in the middle with sideways passing that would put a caffeine addict to sleep.","Need to stop relying on luck or they will be on the first flight home before the postcards arrive.","Did you know England have dropped more points from winning positions than any other European team in World Cup history?"
"SCO","The Bravehearts' Liquid Devastation","An absolute masterclass in tactical stubbornness. Parked a double-decker bus against Morocco, only to concede to an overhead kick that defied all laws of Scottish gravity.","Need to find a forward who can run without looking like he's wading through wet porridge.","Did you know Scotland have played in 8 World Cups and never once made it past the first round? Pain is an art form."
"MAR","Atlas Lions on the Rampage","Liquid football from the Moroccans. Slick one-touches that made the Scottish defense spin like laundry. Hakimi's cross for the winner belonged in the Louvre.","Need to tighten up the backline; they were caught sleeping twice on simple long balls.","Did you know Morocco became the first African nation to reach a World Cup semi-final, and they've kept more clean sheets than any other African team?"
"USA","Star-Spangled Swagger","Smooth control and high-intensity press. Completely rattled Australia with direct running. Christian Pulisic was a walking cheat code, dribbling past defenders as if they were training cones.","Must maintain this intensity in the knockouts; complacency is the only real enemy.","Did you know the USA's 3-0 win against Paraguay in 1930 featured the first-ever hat-trick in World Cup history by Bert Patenaude?"
"AUS","Socceroos' Squeaky Bum Time","An absolute horror show in possession. Handed the ball to the Americans on a silver platter. Completely bottled it in the second half with static defending.","Need to go back to basic passing drills and stop panicking when pressed.","Did you know Australia's nickname 'Socceroos' was coined in 1967 by a journalist named Tony Horstead?"
"BRA","Samba Style or Casual Kickabout?","Breezed past Haiti with Vinicius Jr playing like he was in his back garden. 5-0 looks good, but they missed enough sitters to warrant a stern dressing down.","Need to keep their feet on the ground and show some respect for the offside rule.","Did you know Brazil is the only country to have played in every single World Cup tournament?"
"HAI","Haiti's World Cup Hopes Dashed, Officially Eliminated","Haiti's World Cup campaign has been a tough one, with two losses and zero points. They've struggled to make an impact in Group C.","They are officially eliminated. Their maximum possible points won't be enough to reach the next stage, so it's an early flight home.","Haiti are the first team from Group C to be eliminated, proving that sometimes, the numbers just don't lie."
"PAR","The Snarl and the Sweep","Paraguay's physical display contrasted heavily with Turkey's smooth control. Relentless tackling that bordered on a contact sport. Galarza scored after 64 seconds.","Need to control their tempers; three yellow cards in the second half was playing with fire.","Did you know Paraguay have reached the Round of 16 four times but only made the Quarterfinals once in 2010?"
"TUR","The Swear-O-Meter Disaster","An absolute circus. Normal service was resumed until Almiron got sent off within forty minutes for swearing at the referee, completely derailing their defensive blueprint.","Need to teach their players the international sign language for silence before the next match.","Did you know Turkey finished third in the 2002 World Cup, where Hakan Sükür scored the fastest goal in history (11 seconds)?"
"NED","Dutch Masters Demolish Sweden, Group F Looking Orange!","The Netherlands have been in fine form, and today's 5-1 thrashing of Sweden just cemented their place at the top of Group F. Seven points from three games, and a goal difference that's looking rather healthy.","With qualification all but secured, they can put their feet up and watch the rest of the group stage unfold. Job done, and done with style.","The Netherlands have now scored 12 goals in three games, proving they're not just pretty passers, but proper goal machines!"
"SWE","Sweden's World Cup Dream Dented by Dutch Demolition!","It was a tough day at the office for Sweden, who were absolutely battered by the Netherlands. Conceding five goals is never a good look, and they're now sitting third in Group F with just three points.","They'll be hoping for a miracle in the final round of fixtures, needing results elsewhere to go their way if they're to sneak into the knockout stages as a best third-placed team. It's squeaky bum time!","Sweden conceded more goals in this one match (5) than they had in their previous two combined (6). Ouch."
"GER","Germany Through! Undav's Late Heroics Secure Top Spot!","Three games, three wins for Germany! They left it late against Côte d'Ivoire, but Deniz Undav's brace ensured they maintained their perfect record and secured their passage to the knockouts as Group E winners.","The Germans can now relax, knowing they've topped their group. They'll be looking to maintain momentum and fine-tune things for the business end of the tournament.","Germany has now scored a whopping 11 goals in the group stage, making them one of the most potent attacks in the competition. Clinical!"
"CIV","Côte d'Ivoire's Valiant Effort Falls Short Against Germany!","Côte d'Ivoire put up a brave fight against the mighty Germans, even taking the lead, but ultimately succumbed to a late defeat. They're currently third in Group E with three points.","Their fate now hangs in the balance. They'll need to hope their three points and goal difference are enough to see them through as one of the best third-placed teams. It's out of their hands now.","Despite the loss, Côte d'Ivoire managed to score against Germany, which is more than some teams can say! Small victories, eh?"
"ECU","Ecuador's Goalless Grind Leaves Them in Limbo!","Another game, another draw, and still no goals for Ecuador! Their 0-0 stalemate with Curaçao leaves them stuck on two points in Group E, with their World Cup hopes looking rather bleak.","With only two points and zero goals scored, Ecuador are in a precarious position. They'll need a miracle and a calculator to figure out if they can still progress. Flights home might be on the cards.","Ecuador has played three games and failed to score a single goal. You could say their attack is as potent as a wet paper bag."
"CUW","Curaçao Hold On for a Point, Eloy Room a Hero!","Curaçao managed to grind out a 0-0 draw against Ecuador, largely thanks to their heroic goalkeeper. They're still bottom of Group E with two points, but they showed some real grit.","While a point is a point, it's unlikely to be enough for Curaçao to progress. They'll be heading home, but with their heads held high after a valiant effort today.","Curaçao's Eloy Room made an astonishing 15 saves today, single-handedly keeping his side in the game. Give that man a medal!"
"TUN","Tunisia's World Cup Dream Goes Up in Smoke","It's been a truly forgettable campaign for Tunisia, culminating in a 4-0 thrashing by Japan today. Zero shots on target in their final game tells you all you need to know about their attacking ambition.","Well, they're officially eliminated, so it's back to the drawing board and perhaps a long, hard look in the mirror. Flights home are being booked as we speak.","Did you see Tunisia's attack? More invisible than a referee's common sense, managing a grand total of 0 shots on target today!"
"JPN","Japan Marches On with Style and Clinical Finishing","Japan have been nothing short of brilliant, topping their group with 7 points and a fantastic goal difference. Today's 4-0 victory over Tunisia was a masterclass in clinical finishing.","They've qualified for the knockout stages, so it's time to put their feet up, enjoy the view, and prepare for the next challenge. The Samurai Blue are looking dangerous.","Japan are playing liquid football! Four goals today, and they've only conceded two all tournament. Proper stuff!"
"ESP","Spain's Samba Stars Shine Bright and Qualify Comfortably","Spain have been absolutely dominant, securing top spot in their group with a resounding 4-0 win against Saudi Arabia. They've scored 8 goals and conceded none – a truly impressive record.","Qualified and looking formidable, Spain will be eyeing the later stages of the tournament. They're through, and rightly so.","Spain are playing like they've got an extra man on the pitch! 8 goals scored, 0 conceded, and a comfortable qualification. Who's stopping them?"
"KSA","Saudi Arabia's World Cup Journey Ends in Disappointment","It's been a tough ride for Saudi Arabia, and today's 4-0 defeat to Spain, including an own goal, sealed their fate. They finish bottom of the group with just one point.","They are officially eliminated. Time to pack their bags and reflect on what went wrong. Perhaps a bit more discipline and a lot less giving away yellow cards next time.","Saudi Arabia's defence was more open than a supermarket on Christmas Eve! An own goal and two yellow cards, a truly forgettable performance."
"BEL","Golden Generation Fades Out with a Whimper and a Red Card","Belgium's World Cup campaign has been a disaster, finishing with a goalless draw against Iran and a red card for Nathan Ngoy. Three draws and just one goal scored in three games is simply not good enough.","They are officially eliminated. The 'Golden Generation' has well and truly tarnished its legacy. Time for some serious soul-searching back home.","Belgium had more shots (23) than goals (0) today! And a red card to boot. They've gone home, and frankly, they deserve it after that showing."
"IRN","Iran Dig Deep to Secure Knockout Berth Against All Odds","Iran showed incredible resilience today, holding Belgium to a 0-0 draw despite being under immense pressure. That vital point was enough to see them through to the next round.","They've qualified! A fantastic achievement, proving that grit and determination can get you far. They'll be celebrating this one for a while.","Iran defended like their lives depended on it! And it paid off, they're through to the knockouts. Who'd have thought it?"
"URU","Uruguay Scrapes Through After Thrilling Draw","Uruguay secured their qualification today, but not without a scare, drawing 2-2 with a spirited Cape Verde side. They showed character to come back from a goal down.","They've qualified for the knockout stages. They'll need to tighten up at the back, but they're still in the hunt for the big prize.","Uruguay conceded a free-kick goal and then another, but still managed to qualify! Talk about making hard work of it."
"CPV","Cape Verde's Brave Run Ends in Valiant Draw","Cape Verde fought valiantly today, securing a 2-2 draw against Uruguay, but it wasn't enough to keep their World Cup dream alive. They showed real heart and skill.","They are officially eliminated. A fantastic effort, but ultimately, they're going home. They can hold their heads high, though.","Cape Verde scored two cracking goals against Uruguay, including a free-kick! They might be out, but they certainly left their mark."
"NZL","New Zealand's Brief Moment of Glory Fades Away","New Zealand started brightly, taking the lead against Egypt, but ultimately couldn't hold on, losing 3-1. Their World Cup journey ends with just one point.","They are officially eliminated. A tough pill to swallow, but they gave it a go. Time to start planning for the next one.","New Zealand scored first! And then remembered they were New Zealand. Three goals conceded and out. Bless 'em."
"EGY","Egypt Rises to the Occasion, Led by Salah's Brilliance","Egypt showed their class today, coming from behind to beat New Zealand 3-1. Mohamed Salah was instrumental, proving why he's a walking cheat code.","They've qualified for the knockout stages! A strong performance today means they're through and looking good for the next round.","Salah with a goal and an assist today! The man's a magician. Egypt are through, and they'll be a tough nut to crack."
