"teamId","headline","storySoFar","whatsNext","pubAmmo"
"BIH","The Defensive Circus","Scraped a point against Canada, but absolutely imploded against Switzerland. Two yellows and a straight red in a 20-minute spell turned their defense into a circus in a 4-1 loss.","Need to figure out how to keep 11 men on the pitch if they want any realistic chance of progression.","Did you know Bosnia managed to tackle themselves out of the Switzerland game by collecting three cards between the 59th and 80th minutes?"
"ENG","Slightly Better Than Terrible, But Barely","Scraped by on penalties against Denmark. Absolute Sunday-League coordination in the middle with sideways passing that would put a caffeine addict to sleep.","Need to stop relying on luck or they will be on the first flight home before the postcards arrive.","Did you know England have dropped more points from winning positions than any other European team in World Cup history?"
"SCO","The Bravehearts' Liquid Devastation","An absolute masterclass in tactical stubbornness. Parked a double-decker bus against Morocco, only to concede to an overhead kick that defied all laws of Scottish gravity.","Need to find a forward who can run without looking like he's wading through wet porridge.","Did you know Scotland have played in 8 World Cups and never once made it past the first round? Pain is an art form."
"MAR","Atlas Lions on the Rampage","Liquid football from the Moroccans. Slick one-touches that made the Scottish defense spin like laundry. Hakimi's cross for the winner belonged in the Louvre.","Need to tighten up the backline; they were caught sleeping twice on simple long balls.","Did you know Morocco became the first African nation to reach a World Cup semi-final, and they've kept more clean sheets than any other African team?"
"USA","Star-Spangled Swagger","Smooth control and high-intensity press. Completely rattled Australia with direct running. Christian Pulisic was a walking cheat code, dribbling past defenders as if they were training cones.","Must maintain this intensity in the knockouts; complacency is the only real enemy.","Did you know the USA's 3-0 win against Paraguay in 1930 featured the first-ever hat-trick in World Cup history by Bert Patenaude?"
"AUS","Socceroos' Squeaky Bum Time","An absolute horror show in possession. Handed the ball to the Americans on a silver platter. Completely bottled it in the second half with static defending.","Need to go back to basic passing drills and stop panicking when pressed.","Did you know Australia's nickname 'Socceroos' was coined in 1967 by a journalist named Tony Horstead?"
"BRA","Samba Style or Casual Kickabout?","Breezed past Haiti with Vinicius Jr playing like he was in his back garden. 5-0 looks good, but they missed enough sitters to warrant a stern dressing down.","Need to keep their feet on the ground and show some respect for the offside rule.","Did you know Brazil is the only country to have played in every single World Cup tournament?"
"HAI","The Philly Fryer","Absolute scenes in Philadelphia. Commendable spirit but completely outclassed. Conceded three goals from simple set-pieces which is Sunday League defending at its finest.","Need to practice defending corners unless they enjoy conceding free headers.","Did you know Haiti's 1974 World Cup squad featured Emmanuel Sanon, who scored their only two goals in the history of the tournament?"
"PAR","The Snarl and the Sweep","Paraguay's physical display contrasted heavily with Turkey's smooth control. Relentless tackling that bordered on a contact sport. Galarza scored after 64 seconds.","Need to control their tempers; three yellow cards in the second half was playing with fire.","Did you know Paraguay have reached the Round of 16 four times but only made the Quarterfinals once in 2010?"
"TUR","The Swear-O-Meter Disaster","An absolute circus. Normal service was resumed until Almiron got sent off within forty minutes for swearing at the referee, completely derailing their defensive blueprint.","Need to teach their players the international sign language for silence before the next match.","Did you know Turkey finished third in the 2002 World Cup, where Hakan Sükür scored the fastest goal in history (11 seconds)?"
"NED","Dutch Masters Demolish Sweden, Group F Looking Orange!","The Netherlands have been in fine form, and today's 5-1 thrashing of Sweden just cemented their place at the top of Group F. Seven points from three games, and a goal difference that's looking rather healthy.","With qualification all but secured, they can put their feet up and watch the rest of the group stage unfold. Job done, and done with style.","The Netherlands have now scored 12 goals in three games, proving they're not just pretty passers, but proper goal machines!"
"SWE","Sweden's World Cup Dream Dented by Dutch Demolition!","It was a tough day at the office for Sweden, who were absolutely battered by the Netherlands. Conceding five goals is never a good look, and they're now sitting third in Group F with just three points.","They'll be hoping for a miracle in the final round of fixtures, needing results elsewhere to go their way if they're to sneak into the knockout stages as a best third-placed team. It's squeaky bum time!","Sweden conceded more goals in this one match (5) than they had in their previous two combined (6). Ouch."
"GER","Germany Through! Undav's Late Heroics Secure Top Spot!","Three games, three wins for Germany! They left it late against Côte d'Ivoire, but Deniz Undav's brace ensured they maintained their perfect record and secured their passage to the knockouts as Group E winners.","The Germans can now relax, knowing they've topped their group. They'll be looking to maintain momentum and fine-tune things for the business end of the tournament.","Germany has now scored a whopping 11 goals in the group stage, making them one of the most potent attacks in the competition. Clinical!"
"CIV","Côte d'Ivoire's Valiant Effort Falls Short Against Germany!","Côte d'Ivoire put up a brave fight against the mighty Germans, even taking the lead, but ultimately succumbed to a late defeat. They're currently third in Group E with three points.","Their fate now hangs in the balance. They'll need to hope their three points and goal difference are enough to see them through as one of the best third-placed teams. It's out of their hands now.","Despite the loss, Côte d'Ivoire managed to score against Germany, which is more than some teams can say! Small victories, eh?"
"ECU","Ecuador's Goalless Grind Leaves Them in Limbo!","Another game, another draw, and still no goals for Ecuador! Their 0-0 stalemate with Curaçao leaves them stuck on two points in Group E, with their World Cup hopes looking rather bleak.","With only two points and zero goals scored, Ecuador are in a precarious position. They'll need a miracle and a calculator to figure out if they can still progress. Flights home might be on the cards.","Ecuador has played three games and failed to score a single goal. You could say their attack is as potent as a wet paper bag."
"CUW","Curaçao Hold On for a Point, Eloy Room a Hero!","Curaçao managed to grind out a 0-0 draw against Ecuador, largely thanks to their heroic goalkeeper. They're still bottom of Group E with two points, but they showed some real grit.","While a point is a point, it's unlikely to be enough for Curaçao to progress. They'll be heading home, but with their heads held high after a valiant effort today.","Curaçao's Eloy Room made an astonishing 15 saves today, single-handedly keeping his side in the game. Give that man a medal!"
"TUN","Tunisia's World Cup Dream Goes Up in Smoke","Well, that's that then. Three games, zero points, one goal scored, and a whopping thirteen conceded. Tunisia's World Cup campaign was less a journey and more a quick trip to the local corner shop for a lottery ticket that didn't win.","Tunisia is officially ELIMINATED. Time to pack the bags, book the flights, and perhaps consider a new tactical approach for next time.","Tunisia managed a grand total of 0 shots on target against Japan. That's what you call 'parking the bus, then forgetting where you parked the engine'."
"JPN","Japan Cruises Through Group Stage with Style","Japan has been nothing short of brilliant, securing their spot in the next round with a dominant performance today. Seven points from three games, ten goals scored, and a defence that looks tighter than a drum. Impressive stuff.","Japan is QUALIFIED! They're through to the knockout stages, and on current form, they'll be fancying their chances against anyone.","Japan scored four goals from just five shots on target against Tunisia. That's efficiency, that is. Like a well-oiled machine, or a perfectly timed bullet train."
"ESP","Spain Books Knockout Spot with Effortless Victory","Spain has been a joy to watch, playing some lovely football and securing their passage to the next round with another convincing win. Top of the group and looking utterly dominant.","Spain is QUALIFIED! They've stamped their ticket to the knockout rounds and will be looking to continue their impressive run.","Spain recorded 67.1% possession against Saudi Arabia. They practically owned the ball, probably even asked it for rent money."
"KSA","Saudi Arabia's World Cup Journey Ends with a Whimper","It's been a tough tournament for Saudi Arabia. One point from three games, a solitary goal, and a rather leaky defence. They gave it a go, but ultimately, they were outclassed.","Saudi Arabia is officially ELIMINATED. The dream is over, and it's back to the drawing board for the Green Falcons.","Saudi Arabia's Hassan Al-Tambakti scored an own goal against Spain. A memorable moment, perhaps not for the reasons he'd hoped."
"BEL","Belgium Grinds Out a Draw, Secures Qualification","It wasn't pretty, but Belgium got the job done. A goalless draw, a red card, and a spot in the knockouts secured. They'll need to tighten things up, but they're through, and that's what matters.","Belgium is QUALIFIED! They've made it out of the group, though perhaps not in the most convincing fashion. Still, a win's a win, or a draw's a draw, when it gets you through.","Belgium had 23 shots against Iran but couldn't score. They were shooting for the moon, apparently, and missed the goal entirely."
"IRN","Iran Holds Strong, Qualifies for Knockouts","Iran put in a solid defensive shift today, earning a hard-fought draw and, more importantly, securing their place in the next round. They've shown resilience and a knack for getting results when it counts.","Iran is QUALIFIED! They've navigated the group stage and are now looking forward to the knockout rounds. A fantastic achievement!","Iran's goalkeeper, Alireza Beiranvand, made 7 saves against Belgium. Clearly, he was the busiest man on the pitch, earning his wages and then some."
